{
  "heartbeat_id": "HB-R0-001",
  "sprint_id": "SPR-REACTOR-HEARTBEAT-R0-001",
  "started_at": "2026-05-21T00:08:13.591216+00:00",
  "ended_at": "2026-05-21T00:08:13.592002+00:00",
  "preconditions_verified": 10,
  "decision": "REQUEST_T1",
  "actions_taken": [],
  "actions_not_taken": [
    "RUN_M2_API_REALTIME",
    "RUN_SCHEDULER",
    "RUN_DAEMON",
    "WRITE_CODE",
    "OPEN_PR",
    "DEPLOY",
    "TOUCH_SUPABASE",
    "TOUCH_MEMORY",
    "CANONIZE"
  ],
  "events_appended": 3,
  "status": "COMPLETED",
  "no_assumptions": true
}